{
  "id": "vector",
  "title": { "ja": "ベクトル", "en": "Vector" },
  "summary": { "ja": "加法とスカラー倍が定義され、方向と大きさ、または成分で表せる対象。", "en": "An object that participates in vector addition and scalar multiplication." },
  "prerequisites": ["scalar"],
  "related": ["vector-addition", "linear-combination", "linear-map"],
  "learningObjectives": ["ベクトルを成分で表せる", "ベクトルの等しさを成分ごとに判定できる", "ベクトル空間の計算規則を説明できる"],
  "lessons": [{"id":"vector-lesson-01","title":"ベクトルを対象として見る","summary":"矢印に限定されないベクトルの見方を身につける。","objectives":["ベクトルを成分と演算で説明できる"],"sections":[{"id":"vector-section-01","title":"ベクトルの定義","kind":"definition","body":"ベクトルは加法とスカラー倍が定義された対象です。R^nでは数の組として表します。","claimRefs":["vector-claim-01"]}],"exerciseIds":["vector-exercise-001"]}],
  "claims": [{"id":"vector-claim-01","statement":"ベクトルは加法とスカラー倍に関する構造を持つ対象であり、矢印に限られない。","sourceRefs":[{"source":"mit-ocw-linear-algebra","locator":"Lecture 1: The geometry of linear equations"}]}],
  "content": { "explanation": "ベクトルは矢印だけに限らず、加法とスカラー倍という2つの演算を持つ対象です。R^nではn個の数を並べた組として表し、同じ位置の成分を足したり、すべての成分にスカラーを掛けたりします。抽象的な定義を採用すると、関数や多項式もベクトルとして扱えます。" },
  "examples": [{ "id": "vector-example-001", "statement": "u=(1,2), v=(-3,4) のとき u+v を求める。", "explanation": "成分ごとに加えるので u+v=(-2,6) です。" }],
  "exercises": [{ "id": "vector-exercise-001", "type": "short-answer", "difficulty": "basic", "question": "u=(2,-1,3) と v=(0,4,-3) の内訳を使わず u+v を求めよ。", "answer": "(2, 3, 0)", "explanation": "各成分を足します: (2+0, -1+4, 3-3)。" }],
  "misconceptions": ["ベクトルは平面や空間の矢印だけではない。演算規則を満たす関数などもベクトルになり得る。", "ベクトルの成分の個数は、置かれたベクトル空間によって決まる。"],
  "sources": ["mit-ocw-linear-algebra", "openstax-linear-algebra"]
}
